<?xml version="1.0" encoding="UTF-8"?>
<!-- Copyright DASSAULT SYSTEMES 2011 -->
<RelationsList xmlns="DS_DELPPWConfiguration" xmlns:xsi="http://www.w3.org/2001/XMLSchema-instance" xsi:schemaLocation="DS_DELPPWConfiguration ../xsd/ModelRelations.xsd" Title="PPR Relations" Description="Sample configuration file delivered by DS.">

  <SYSTEM>
    <SYSTEM>
      <Relation type="DELLmiMaterialPathCnxCust" read="true" write="false"/>
      <Relation type="LinearProductFlowCnx" read="true" write="false"/>
	    <Relation type="DELLmiTimeConstraintCnx" read="true" write="false"/>
    </SYSTEM>
	  <OPERATION>
      <Relation type="DELLmiTimeConstraintCnx" read="true" write="false"/>
    </OPERATION>
  </SYSTEM>
  <OPERATION>
    <OPERATION>
      <Relation type="DELLmiTimeConstraintCnx" read="true" write="false"/>
      <Relation type="LinearProductFlowCnx" read="true" write="false"/>
    </OPERATION>
	  <SYSTEM>
      <Relation type="DELLmiTimeConstraintCnx" read="true" write="false"/>
    </SYSTEM>
  </OPERATION>
</RelationsList>
